{
  "schemaVersion": 1,
  "id": "11111111-1111-1111-1111-111111111111",
  "policyId": "22222222-2222-2222-2222-222222222222",
  "policyVersion": 1,
  "proposalId": "33333333-3333-3333-3333-333333333333",
  "proposalRevisionId": "44444444-4444-4444-4444-444444444444",
  "evaluatedAt": "2026-08-30T22:00:00Z",
  "result": "would-allow",
  "reasonCodes": [],
  "executionPerformed": false
}
